{
	"lang": "ja",
	"title": "No Meat Proxy",
	"description": "AIは道具であり、あなたが道具になってはいけません",
	"ogSiteName": "No Meat Proxy",
	"ogImageAlt": "No Meat Proxyのロゴと、その隣に「AIは道具であり、あなたが道具になってはいけません。」と書かれたスローガン。",
	"brand": {
		"logoAlt": "No Meat Proxyのロゴ"
	},
	"hook": "AIは道具であり、あなたが道具になってはいけません。",
	"example1": {
		"heading": "AIの回答を人に送り付けないでください",
		"dontLabel": "✕ やめてください",
		"doLabel": "✓ こうしましょう",
		"question": "機能の切り替えはどのように行われるのですか？ユーザーごとに設定できますか？",
		"dontAnswer": "ここで採用されている機能フラグシステムは、設定ベースの独自実装です。定義: FeatureToggles クラスという @ConfigurationProperties のデータクラスがあり、enableNewCheckoutFlow や useOptimizedSearchIndex などの真偽値フィールドを持っています。これは FeatureConfig クラス内で、 @EnableConfigurationProperties を使って登録されています。利用方法: FeatureToggles を注入し、そのプロパティを見て分岐します。例えば、 if (!featureToggles.enableNewCheckoutFlow) で `ForbiddenException` をスローする、といった使い方です。一部のフラグは早期リターンや例外による処理の中断を制御し、別のフラグでは実装そのものを切り替えています。設定: 設定は app.feature-toggles.* 配下の通常の YAML で記述され、プロファイルごとに上書きできます。また、標準的な @ConfigurationProperties を利用しているため、環境変数からも上書き可能です。そのため、現在の実装ではユーザーごとに機能の有効・無効を切り替えることはできません。",
		"doAnswer": "残念ながらできません。オンオフの切り替えはハードコードされています。",
		"paragraph1": "AIの回答をそのまま垂れ流すだけでは、質問した相手をさらに困らせることになります。AIが生成した回答は、往々にして冗長で複雑で、時折求められてもいない詳細情報が含まれがちです。相手はあなたの判断を信頼しているから、あなたに尋ねたのです。AIの出力を転送するだけでは、あなたはただの「生身の中継役」に過ぎません。",
		"paragraph2": "もしあなたが、人とAIの間でメッセージを仲介しているだけなら、あなたの価値はどのようなものでしょうか？",
		"consequencesIntro": "AIの回答をそのまま返信するだけなら、あなたは:",
		"consequences": [
			"周りの人の手間を増やしています。",
			"自分自身が代替可能であることを示しています。",
			"実際には役に立ちません。",
			"カッコ悪そうに見えます。",
			"人からの信頼を損なっていくでしょう。"
		],
		"avoidHeading": "避けるべきその他のこと:",
		"avoidList": [
			"長い長いAIの出力を貼り付けて、議論に「貢献」しないでください。",
			"「こんな問題に直面しています: &lt;バカみたいに長いAI生成のテキスト&gt;」のように質問しないでください。"
		],
		"insteadHeading": "代わりに、こうすべきです:",
		"insteadList": [
			"AIの出力を読み、検証しましょう。",
			"自分なりに、答えや質問を考えてみてください。",
			"有意義な貢献ができる時は、議論に参加して「貢献」しましょう。"
		],
		"closing": "人らしく答え、人らしく扱いましょう。生身の中継役にならないでください！"
	},
	"example2": {
		"heading": "中身について理解・検証していないAI生成物を提出しないでください",
		"dontLabel": "✕ やめてください",
		"doLabel": "✓ こうしましょう",
		"reviewComment1": "なぜこのエラーを伝播させずに握り潰しているのですか？",
		"dontReviewComment2": "さあ？Claudeがそうやって書いたから。",
		"doReviewComment2": "上流側ではあらゆるエラーに対してリトライしますが、これについてはバックフィル中に発生しうるものなので、ログを記録した上で破棄しています。コメントを追加しておきますね。時間がある時に、アップストリーム側の処理を書き直すチケットを作成しておきましょうか？",
		"paragraph1": "AIがほとんどの仕事を肩代わりしてくれるとはいえ、あなたには責任があり、そしてあなたの名前が記されます。あなたの名前がある限り、それはあなたの仕事です。あなたには行った仕事の内容を理解し、検証し、それを自らの責任として受け入れる必要があります。",
		"consequencesIntro": "盲目的にAI生成物を提出することで、あなたは:",
		"consequences": [
			"自分の仕事を理解し検証する負担を、他人に押し付けています。",
			"自分でやるのが面倒なことを他者に押し付け、敬意を欠く態度を示しています。",
			"あなたの仕事はダブルチェックが必要であることを示しています。",
			"カッコ悪そうに見えます。",
			"自分自身が代替可能であることを示しています。"
		],
		"avoidHeading": "避けるべきその他のこと:",
		"avoidList": [
			"自分の仕事に対するフィードバックに、AIで返さないでください。",
			"フィードバックを受ける時、AIのせいにしないでください。",
			"「AIがやったから」と言って、知識不足を正当化しないでください。",
			"AIが関与しているからといって、基準を下げないでください。"
		],
		"insteadHeading": "代わりに、こうしましょう:",
		"insteadList": [
			"仕事について、よく読んで、理解して、検証しましょう。",
			"仕事に対する責任者として、フィードバックに返信しましょう。",
			"自分の仕事であるかのように、責任を持って取り組みましょう。（あなたの名前が書いてあるのですから、あなたのものです。）",
			"熱意を持って仕事していることを、周りの人に示しましょう。"
		],
		"closing": "自分の名前が載っている仕事には責任を持ってください。人から頼られるような存在になってください。生身の中継役になってはいけません。"
	},
	"whyMatters": {
		"heading": "なぜこれが重要なのか:",
		"originalInspirationNote": " (このサイトの原案)"
	},
	"share": {
		"prompt": "生身の中継役にお困りですか？このページを共有しましょう:",
		"copyLabel": "リンクをコピー",
		"copiedLabel": "コピーしました！",
		"secondary": "または、これでリアクションしましょう:"
	},
	"footer": {
		"inspiredByHeading": "参考にしたサイト:",
		"alsoAvailable": "他の言語でも利用できます:",
		"sourcePrefix": "ソースは",
		"sourceSuffix": "にあります。",
		"createdByPrefix": "作成者: ",
		"createdBySuffix": "。",
		"disclaimer": "(先に断っておくと、このウェブサイトの一部はAIによって生成されています。私はCSSやフロントエンドなど、全体的に苦手なのです。)"
	}
}
